"Product No.","Manufacturer Product No.","Product Description","Total SOH","Price Before Discount Ex Vat"
"ADA-7115BLK","7115BLK","Adam Hall Cables 7115 BLK - Instrument Cable black","800","R 34.00"
"ADA-7510","7510","Adam Hall Connectors 7510 - 6.3mm Jack Plug  mono  Gold","144","R 79.00"
"ADA-7511","7511","Adam Hall Connectors 7511 - 6.3mm Jack Plug stereo gold","29","R 52.00"
"ADA-7514","7514","Adam Hall Connectors 7514 - 6.3mm Jack Plug mono","59","R 12.00"
"ADA-7540","7540","Adam Hall Connectors 7540 - Adapter mono RCA female to 6.3mm mono Jack male","29","R 13.00"
"ADA-7541","7541","Adam Hall Connectors 7541 - Adapter 6.3mm mono Jack female to mono RCA male","25","R 48.00"
"ADA-7545","7545","Adam Hall Connectors 7545 - Y-Adapter 2 x 3.5mm stereo Jack female to 6.3mm stereo","25","R 71.00"
"ADA-7546","7546","Adam Hall Connectors 7546 - Y-Adapter 2 x 6.3mm stereo Jack female to 6.3mm stereo","134","R 50.00"
"ADA-7549","7549","Adam Hall Connectors 7549 - Y-Connector 2 x mono RCA female to 6.3mm stereo Jack male","90","R 09.00"
"ADA-7550","7550","Adam Hall Connectors 7550 - Y-Connector 2 x mono RCA female to 3.5mm stereo Jack male","317","R 08.00"
"ADA-7551","7551","Adam Hall Connectors 7551 - Adapter 6.3mm stereo Jack female to 6.3mm stereo Jack","45","R 51.00"
"ADA-7552","7552","Adam Hall Connectors 7552 - Adapter 2 x mono RCA female to 2 x mono RCA female","45","R 49.00"
"ADA-7556","7556","Adam Hall Connectors 7556 - Y-Adapter 2 x stereo Jack 3.5mm female to stereo Jack 3.5mm male","237","R 06.00"
"ADA-7853","7853","Adam Hall Connectors 7853 - Adapter 6.3mm Jack stereo female to XLR M","262","R 29.00"
"ADA-7855","7855","Adam Hall Connectors 7855 - Adapter 6.3mm Jack stereo male to XLR M","24","R 28.00"
"ADA-7856","7856","Adam Hall Connectors 7856 - Adapter 6.3mm Jack stereo male to XLR F","123","R 28.00"
"ADA-7857","7857","Adam Hall Connectors 7857 - Adapter RCA female to XLR M","4","R 109.00"
"ADP-DAI-AU-2X0","DAI-AU-2X0","Audinate Dante AVIO Analog Input Adapter 2 Ch","11","R 6,097.00"
"ADP-DAO-AU-0X1","DAO-AU-0X1","Audinate Dante AVIO Analog Output Adapter 1 Ch","11","R 4,869.00"
"ADP-DAO-AU-0X2","DAO-AU-0X2","Audinate Dante AVIO Analog Output Adapter 2 Ch","7","R 6,097.00"
"ADP-DVS-TK-RES","DVS-TK-RES","Audinate Dante Virtual Soundcard Software Token for Single Machine (Download) (Redeemable for Permanent DVS License)","30","R 875.00"
"ADP-DVS-VM-001","DVS-VM-001","Audinate DVS for Virtual Machines Dante Virtual Soundcard (Sold as Min 5 activation tokens) (Download)","0","R 12,128.00"
"ADP-USB-AU-2X2","USB-AU-2X2","Audinate Dante AVIO USB IO Adapter 2X2 Ch","18","R 4,869.00"
"ADP-USBC-AU-2X2","USBC-AU-2X2","Audinate Dante AVIO USBC IO Adapter 2x2","9","R 4,869.00"
"ADP-VIA-TK-001","VIA-TK-001","Audinate Dante Via Audio Networking Software Token for Single Machine (Download)","0","R 1,050.00"
"AID-CBL-RJ45","CBL-RJ45","Aida Imaging 8-Pin RS232 to Cross RJ45 Cable Connector Cable","0","R 338.00"
"AID-CCS-USB","CCS-USB","Aida Imaging VISCA Camera Control Unit & Software","0","R 3,936.00"
"AID-CCU-IP","CCU-IP","Aida Imaging VISCA Serial and IP PTZ Camera Controller","0","R 12,061.00"
"AID-CCU-MINI","CCU-MINI","Aida Imaging Compact VISCA Serial and IP PTZ Camera Controller","0","R 7,188.00"
"AID-CS-0550V","CS-0550V","Aida Imaging HD Varifocal 5.0-50mm Manual Iris CS Mount Lens","1","R 3,262.00"
"AID-CS-12.0F","CS-12.0F","Aida Imaging 12mm HD CS Mount Lens","0","R 825.00"
"AID-CS-2812V","CS-2812V","Aida Imaging HD Varifocal 2.8-12mm Manual Iris CS Mount Lens","0","R 3,262.00"
"AID-CS4K-3611V","CS4K-3611V","Aida Imaging 4K Varifocal 3.6~11mm Auto-DC Iris CS Mount Lens","0","R 3,936.00"
"AID-CS4K-5.0F","CS4K-5.0F","Aida Imaging 4K 5mm HFOV 66 Manual Focus CS Mount Lens","0","R 2,062.00"
"AID-CS-6.0F","CS-6.0F","Aida Imaging 6mm HD CS Mount Lens","0","R 825.00"
"AID-CS-8.0F","CS-8.0F","Aida Imaging 8mm 5Mega Pixel CS Mount Lens","0","R 825.00"
"AID-GCON-HDMI","GCON-HDMI","Aida Imaging HDMI Genlock converter w/ Active Loop Out","0","R 11,621.00"
"AID-GCON-SDI","GCON-SDI","Aida Imaging SDI Genlock converter w/ Active Loop Out","0","R 11,621.00"
"AID-GEN3G-IPC-200","GEN3G-IPC-200","Aida Imaging FHD Genlock 3G-SDI/HDMI with IP Control POV Camera","0","R 19,371.00"
"AID-HD-100A","HD-100A","Aida Imaging FHD HDMI POV Camera (Multi HD Format) with TRS Sterio Audio Input","0","R 7,123.00"
"AID-HD-100A-IP67","HD-100A-IP67","Aida Imaging FHD HDMI POV Weatherproof Camera with TRS Sterio Audio Input","0","R 8,528.00"
"AID-HD3G-IPC-100A","HD3G-IPC-100A","Aida Imaging FHD 3G-SDI with IP Control POV Camera","0","R 9,137.00"
"AID-HD3G-IPC-IP67","HD3G-IPC-IP67","Aida Imaging FHD 3G-SDI with IP Control Weatherproof IP67 POV Camera","0","R 9,625.00"
"AID-HD3G-IPC-MINI","HD3G-IPC-MINI","Aida Imaging FHD 3G-SDI with IP Control, Lipstick Weatherproof IP67 POV Camera","0","R 9,625.00"
"AID-HD3G-IPC-TF","HD3G-IPC-TF","Aida Imaging FHD 3G-SDI with IP Control, Varifocal Lens 05-50mm Weatherproof IP54 POV Camera","0","R 11,574.00"
"AID-HD3G-NDI-200","HD3G-NDI-200","Aida Imaging FHD NDI|HX/IP/SRT/3G-SDI PoE and IP Control POV Camera","0","R 12,061.00"
"AID-HD-NDI-200","HD-NDI-200","Aida Imaging FHD NDI|HX/HDMI/IP PoE POV Camera","1","R 10,946.00"
"AID-HD-NDI3-120","HD-NDI3-120","Aida Imaging FHD 120fps NDI |HX3/IP/SRT/HDMI PoE POV Camera","0","R 18,209.00"
"AID-HD-NDI3-IP67","HD-NDI3-IP67","Aida Imaging FHD 120fps NDI |HX3/IP/SRT PoE Weatherproof POV Camera","0","R 19,465.00"
"AID-HD-NDI-CUBE","HD-NDI-CUBE","Aida Imaging FHD NDI|HX/IP POV Camera","0","R 9,625.00"
"AID-HD-NDI-IP67","HD-NDI-IP67","Aida Imaging FHD NDI|HX/IP Weatherproof POV Camera","0","R 9,625.00"
"AID-HD-NDI-MINI","HD-NDI-MINI","Aida Imaging FHD NDI|HX/IP Weatherproof Cylinder POV Camera","0","R 9,625.00"
"AID-HD-NDI-TF","HD-NDI-TF","Aida Imaging FHD NDI|HX/SRT/IP PoE Weatherproof IP54 POV Camera with 05-50mm Varifocal Lens","0","R 11,574.00"
"AID-HD-NDI-VF","HD-NDI-VF","Aida Imaging FHD NDI |HX/IP/SRT PoE Weatherproof Vaifocal Lens 2.8-12mm POV Camera","0","R 11,574.00"
"AID-HD-NDI-X20","HD-NDI-X20","Aida Imaging FHD NDI|HX/IP/SRT/HDMI PoE 20X Zoom POV Camera","0","R 16,934.00"
"AID-HD-X3L-IP67","HD-X3L-IP67","Aida Imaging FHD Weatherproof 3G-SDI 3.5X Optical Zoom POV Camera","0","R 12,061.00"
"AID-IPCOMM-POE","IPCOMM-POE","Aida Imaging Portable Wireless Video & Control Transmitter with PoE+ Injection / NPF Battery Support (NPF Battery not included)","0","R 6,701.00"
"AID-M12-6.0F","M12-6.0F","Aida Imaging 6.0mm HD Megapixel M12 Mount Lens for AIDA HD-NDI-MINI","0","R 550.00"
"AID-PTZ4K12G-FNDI-X30B","PTZ4K12G-FNDI-X30B","Aida Imaging Broadcast/Conference 4K Full Bandwidth NDI 12G & 3G-SDI/HDMI/USB/SRT/IP/NDI HX/HX3, Auto-tracking, FreeD, Genlock, SFP+, XLR, SD recording, 30X Zoom PTZ Camera in Black","0","R 85,279.00"
"AID-PTZ4K12G-FNDI-X30W","PTZ4K12G-FNDI-X30W","Aida Imaging Broadcast/Conference 4K Full Bandwidth NDI 12G & 3G-SDI/HDMI/USB/SRT/IP/NDI HX/HX3, Auto-tracking, FreeD, Genlock, SFP+, XLR, SD recording, 30X Zoom PTZ Camera in White","0","R 85,279.00"
"AID-PTZ4K-NDI-X12B","PTZ4K-NDI-X12B","Aida Imaging Broadcast/Conference NDI |HX 4K NDI/IP/SRT/HDMI PoE PTZ Camera 12X Zoom Black","0","R 42,570.00"
"AID-PTZ4K-NDI-X12W","PTZ4K-NDI-X12W","Aida Imaging Broadcast/Conference NDI |HX 4K NDI/IP/SRT/HDMI PoE PTZ Camera 12X Zoom White","0","R 42,570.00"
"AID-PTZ4K-NDI-X30B","PTZ4K-NDI-X30B","Aida Imaging Broadcast/Conference NDI|HX 4K NDI/IP/HDMI PTZ Camera 30X Zoom Black","0","R 50,105.00"
"AID-PTZ4K-NDI-X30W","PTZ4K-NDI-X30W","Aida Imaging Broadcast/Conference NDI|HX 4K NDI/IP/HDMI PTZ Camera 30X Zoom White","0","R 50,105.00"
"AID-PTZ-NDI3-X20B","PTZ-NDI3-X20B","Aida Imaging Broadcast/Conference NDI |HX3 120fps FHD NDI/IP/SRT/HDMI PoE PTZ Camera 20X Zoom Black","0","R 36,417.00"
"AID-PTZ-NDI3-X20W","PTZ-NDI3-X20W","Aida Imaging Broadcast/Conference NDI |HX3 120fps FHD NDI/IP/SRT/HDMI PoE PTZ Camera 20X Zoom White","0","R 36,417.00"
"AID-PTZ-NDI-X12","PTZ-NDI-X12","Aida Imaging Broadcast/Conference NDI|HX FHD NDI/IP/SDI/HDMI/USB3 PTZ Camera 12X Zoom","0","R 26,371.00"
"AID-PTZ-NDI-X18B","PTZ-NDI-X18B","Aida Imaging Broadcast/Conference NDI|HX FHD NDI/IP/HDMI PTZ Camera 18X Zoom Black","0","R 19,380.00"
"AID-PTZ-NDI-X18W","PTZ-NDI-X18W","Aida Imaging Broadcast/Conference NDI|HX FHD NDI/IP/HDMI PTZ Camera 18X Zoom White","0","R 19,380.00"
"AID-PTZ-NDI-X20","PTZ-NDI-X20","Aida Imaging Broadcast/Conference NDI|HX FHD NDI/IP/SDI/HDMI/USB3 PTZ Camera 20X Zoom","0","R 27,627.00"
"AID-PTZ-X12-IP","PTZ-X12-IP","Aida Imaging Broadcast/Conference FHD IP/SDI/HDMI/USB3 PTZ Camera 12X Zoom","0","R 22,604.00"
"AID-PTZ-X20-IP","PTZ-X20-IP","Aida Imaging Broadcast/Conference FHD IP/SDI/HDMI/USB3 PTZ Camera 20X Zoom","0","R 23,860.00"
"AID-TGEN-6P","TGEN-6P","Aida Imaging 3G-SDI/HD-SDI Tri-Level Genlock Sync Generator","0","R 22,491.00"
"AID-UHD-100A","UHD-100A","Aida Imaging UHD 4K/30 HDMI 1.4 POV Camera with TRS Sterio Audio Input","0","R 14,994.00"
"AID-UHD6G-200","UHD6G-200","Aida Imaging UHD 4K/30 6G-SDI POV Camera","0","R 21,929.00"
"AID-UHD-NDI3-300","UHD-NDI3-300","Aida Imaging UHD 4K/60 NDI |HX3/IP/SRT/HDMI PoE POV Camera","0","R 21,976.00"
"AID-UHD-NDI3-IP67","UHD-NDI3-IP67","Aida Imaging UHD 4K/60 NDI |HX3/IP/SRT PoE Weatherproof POV Camera","0","R 23,232.00"
"AID-UHD-NDI3-X30","UHD-NDI3-X30","Aida Imaging UHD 4K/60 NDI |HX3/IP/SRT/HDMI PoE 30X Zoom POV Camera","0","R 26,999.00"
"AID-UHD-X3L","UHD-X3L","Aida Imaging UHD 4K/30 HDMI 1.4 3X Zoom POV Camera","1","R 17,431.00"
"AID-WM-PTZ","WM-PTZ","Aida Imaging PTZ Universal Wall Mount Bracket","0","R 1,200.00"
"AID-WM-PTZ-W","WM-PTZ-W","Aida Imaging PTZ Universal Wall Mount Bracket White","0","R 1,200.00"
"AMP-026-4026-100","026-4026-100","Amphenol Standard JAWS AC series (XLR) Cable O.D 6.5mm to 8mm","0","R 09.00"
"AMP-026-4027-000","026-4027-000","Amphenol Large JAWS AC series (XLR) Cable O.D 3mm to 6.5mm","0","R 09.00"
"AMP-50260002-521","50260002-521","Amphenol T Series JAWS Large Cable O.D 6mm to 7.5mm","0","R 09.00"
"AMP-50260003-521","50260003-521","Amphenol T Series JAWS Standard Cable O.D 3mm to 6mm","0","R 09.00"
"AMP-AC3F","AC3F","Amphenol Female XL 3 Inline, Stamped contacts, Nickel finish","2355","R 67.00"
"AMP-AC3F3FBW","AC3F3FBW","Amphenol METAL FEMALE TO FEMALE 3 POLE","0","R 218.00"
"AMP-AC3F3FW","AC3F3FW","Amphenol Female to Female Adaptor","48","R 203.00"
"AMP-AC3F5MW","AC3F5MW","Amphenol XLR 3pin female to 5pin male adapter, Pre-wired, Metal","46","R 296.00"
"AMP-AC3FB","AC3FB","Amphenol Female XLR 3 Inline, Stamped contacts, Black finish","0","R 72.00"
"AMP-AC3F-BULK","AC3F-BULK","Amphenol METAL PLUG STR CORD 3 SKT","0","R 66.00"
"AMP-AC3FDZ","AC3FDZ","Amphenol Female XLR 3 Chassis, Stamped, Nickle Finish (Pro)","361","R 76.00"
"AMP-AC3FDZB","AC3FDZB","Amphenol Female XLR 3 Chassis, Stamped, Black Finish (Pro)","0","R 84.00"
"AMP-AC3M3MW","AC3M3MW","Amphenol Male to Male Adaptor","0","R 184.00"
"AMP-AC3M5FW","AC3M5FW","Amphenol XLR 3pin male to 5pin female adapter, Pre-wired, Metal","10","R 425.00"
"AMP-AC3MB","AC3MB","Amphenol Male XLR 3 Inline, stamped contacts, black finish","0","R 63.00"
"AMP-AC3MM","AC3MM","Amphenol Male XLR 3 Inline, Machined contacts, Nickel finish","2949","R 72.00"
"AMP-AC3MMB","AC3MMB","Amphenol Male XLR 3 Inline, Machined contacts, Black finish","0","R 77.00"
"AMP-AC3MMDZ","AC3MMDZ","Amphenol Male XLR 3 Chassis, Machined contacts, Nickle (Pro)","371","R 72.00"
"AMP-AC3MMDZB","AC3MMDZB","Amphenol Male XLR 3 Chassis, Machined contacts, Black (Pro)","0","R 77.00"
"AMP-AC4F","AC4F","Amphenol Female XLR 4 Inline, Machined contacts, Nickel finish","26","R 162.00"
"AMP-AC4FDZ","AC4FDZ","Amphenol Female XLR 4 Chassis, Machined contacts, Nickel","25","R 166.00"
"AMP-AC4M","AC4M","Amphenol Male XLR 4 Inline, Machined contacts, Nickel finish","9","R 104.00"
"AMP-AC4MDZ","AC4MDZ","Amphenol Male XLR 4 Chassis, Machined contacts, Nickel finish","50","R 97.00"
"AMP-AC5F","AC5F","Amphenol Female XLR 5 Inline, Machined contacts, Nickel finish","29","R 200.00"
"AMP-AC5FB","AC5FB","Amphenol Female XLR 5 Inline, Machined contacts, Black finish","0","R 206.00"
"AMP-AC5FDZ","AC5FDZ","Amphenol Female XLR 5 Chassis, Machined contacts, Nickel","0","R 209.00"
"AMP-AC5M","AC5M","Amphenol Male XLR 5 Inline, Machined contacts, Nickel finish","25","R 109.00"
"AMP-AC5MB","AC5MB","Amphenol Male XLR 5 Inline, Machined contacts, Black finish","0","R 114.00"
"AMP-AC5MDZ","AC5MDZ","Amphenol Male XLR 5 Chassis, Machined contacts, Nickel finish","20","R 117.00"
"AMP-AC7F","AC7F","Amphenol 7 pin XLR female inline","9","R 387.00"
"AMP-AC7M","AC7M","Amphenol 7 pin XLR Male inline","7","R 220.00"
"AMP-AC-BNC-JJ-75","AC-BNC-JJ-75","Amphenol Bulkhead Adapter-Isolated, 'D' Shell Housing, BNC","0","R 252.00"
"AMP-AC-GROMMET-BRN","AC-GROMMET-BRN","Amphenol Brown Coloured Grommet to suit AC, T and M series","99","R 09.00"
"AMP-AC-GROMMET-GRN","AC-GROMMET-GRN","Amphenol Green Coloured Grommet to suit AC, T and M series","171","R 09.00"
"AMP-AC-GROMMET-GRY","AC-GROMMET-GRY","Amphenol Grey Coloured Grommet to suit AC, T and M series","1373","R 09.00"
"AMP-AC-GROMMET-ORG","AC-GROMMET-ORG","Amphenol Orange Coloured Grommet to suit AC, T and M series","229","R 09.00"
"AMP-AC-GROMMET-RED","AC-GROMMET-RED","Amphenol Red Coloured Grommet to suit AC, T and M series","60","R 09.00"
"AMP-AC-GROMMET-VIO","AC-GROMMET-VIO","Amphenol Violet Coloured Grommet to suit AC, T and M series","0","R 09.00"
"AMP-AC-GROMMET-WHT","AC-GROMMET-WHT","Amphenol White Coloured Grommet to suit AC, T and M series","93","R 09.00"
"AMP-AC-GROMMET-YEL","AC-GROMMET-YEL","Amphenol Yellow Coloured Grommet to suit AC, T and M series","60","R 09.00"
"AMP-AC-HDMI-RR","AC-HDMI-RR","Amphenol HDMI-HDMI Feedthrough D Type panel mount (Nickel)","25","R 195.00"
"AMP-AC-HDMI-RRB","AC-HDMI-RRB","Amphenol HDMI-HDMI Feedthrough D Type panel mount (Black)","0","R 195.00"
"AMP-ACJD-BLK","ACJD-BLK","Amphenol RCA, chassis mount, gold plated contacts,black insulator","150","R 125.00"
"AMP-ACJD-RED","ACJD-RED","Amphenol RCA, chassis mount, gold plated contacts,red insulator","203","R 125.00"
"AMP-ACJD-WHT","ACJD-WHT","Amphenol RCA, chassis mount, gold plated contacts,white insulator","142","R 125.00"
"AMP-ACJD-YEL","ACJD-YEL","Amphenol RCA, chassis mount, gold plated contacts,yellow insulator","86","R 125.00"
"AMP-ACJM-MC","ACJM-MC","Amphenol Mono Jack Chassis Female Metal Nut","0","R 25.00"
"AMP-ACJR-BLK","ACJR-BLK","Amphenol RCA female, inline, gold plated contacts, black","259","R 68.00"
"AMP-ACJR-RED","ACJR-RED","Amphenol RCA female, inline, gold plated contacts, red","284","R 68.00"
"AMP-ACJR-WHT","ACJR-WHT","Amphenol RCA female, inline, gold plated contacts, white","184","R 68.00"
"AMP-ACJR-YEL","ACJR-YEL","Amphenol RCA female, inline, gold plated contacts, yellow","0","R 68.00"
"AMP-ACJS-MC","ACJS-MC","Amphenol Stereo Jack Chassis Metal Nut","0","R 24.00"
"AMP-ACJS-MH","ACJS-MH","Amphenol Stereo Jack Chassis Metal Nut PCB","0","R 24.00"
"AMP-ACJS-PC","ACJS-PC","Amphenol Stereo Jack Chassis Plastic Nut","0","R 24.00"
"AMP-ACJS-PH","ACJS-PH","Amphenol Stereo Jack Chassis Plastic Nut PCB","0","R 24.00"
"AMP-AC-NUT-BLU","AC-NUT-BLU","Amphenol Blue Coloured Boot/Backshell","0","R 22.00"
"AMP-AC-NUT-BRN","AC-NUT-BRN","Amphenol Brown Coloured Boot/Backshell","60","R 22.00"
"AMP-AC-NUT-GRN","AC-NUT-GRN","Amphenol Green Coloured Boot/Backshell","0","R 22.00"
"AMP-AC-NUT-GRY","AC-NUT-GRY","Amphenol Grey Coloured Boot/Backshell","0","R 22.00"
"AMP-AC-NUT-J-BLK","AC-NUT-J-BLK","Amphenol Black Coloured 8.5mm GROMMET 100/BOX","0","R 22.00"
"AMP-AC-NUT-METAL","AC-NUT-METAL","Amphenol Metal Backshell","144","R 150.00"
"AMP-AC-NUT-ORG","AC-NUT-ORG","Amphenol Orange Coloured Boot/Backshell","0","R 22.00"
"AMP-AC-NUT-RED","AC-NUT-RED","Amphenol Red Coloured Boot/Backshell","4","R 22.00"
"AMP-AC-NUT-VIO","AC-NUT-VIO","Amphenol Violet Coloured Boot/Backshell","20","R 22.00"
"AMP-AC-NUT-WHT","AC-NUT-WHT","Amphenol White Coloured Boot/Backshell","54","R 22.00"
"AMP-AC-NUT-YEL","AC-NUT-YEL","Amphenol Yellow Coloured Boot/Backshell","36","R 22.00"
"AMP-ACPM-GB","ACPM-GB","Amphenol Mono Jack Plug Diecast Shell Blck","0","R 62.00"
"AMP-ACPM-GN","ACPM-GN","Amphenol Mono Jack Plug Diecast Shell Sil","0","R 60.00"
"AMP-ACPM-KN","ACPM-KN","Amphenol M-SERIES II Mono Jack Plug Diecast Shell Sil","149","R 70.00"
"AMP-ACPM-RB","ACPM-RB","Amphenol Mono Jack Plug Diecast Shell Nickel 90deg angle","0","R 71.00"
"AMP-ACPM-RN","ACPM-RN","Amphenol Mono Jack Plug Diecast Shell Black 90deg angle","6","R 70.00"
"AMP-ACPR-BLK","ACPR-BLK","Amphenol RCA male, inline, gold plated contact, black","64","R 67.00"
"AMP-ACPR-RED","ACPR-RED","Amphenol RCA male, inline, gold plated contact, red","126","R 67.00"
"AMP-ACPR-WHT","ACPR-WHT","Amphenol RCA male, inline, gold plated contact, white","0","R 67.00"
"AMP-ACPR-YEL","ACPR-YEL","Amphenol RCA male, inline, gold plated contact, yellow","1","R 67.00"
"AMP-ACPS-GB","ACPS-GB","Amphenol Stereo Jack Plug Diecast Shell Blck","339","R 77.00"
"AMP-ACPS-GN","ACPS-GN","Amphenol Stereo Jack Plug Diecast Shell Sil","0","R 76.00"
"AMP-ACPS-KN","ACPS-KN","Amphenol M-SERIES II Stereo Jack Plug Diecast Shell Sil","625","R 84.00"
"AMP-ACPS-RB","ACPS-RB","Amphenol Stereo Jack Plug Diecast Shell Nickel 90deg angle","0","R 92.00"
"AMP-ACPS-RN","ACPS-RN","Amphenol Stereo Jack Plug Diecast Shell Black 90deg angle","68","R 91.00"
"AMP-AX3M","AX3M","Amphenol Male XLR 3 Inline, Chuck style cable clamp, Nickel","2014","R 83.00"
"AMP-AX5F","AX5F","Amphenol Female XLR 5 Inline, Machined contacts, Nickel finish","0","R 199.00"
"AMP-AX5M","AX5M","Amphenol Male XLR 5 Inline, Machined contacts, Nickel finish","0","R 116.00"
"AMP-AXX3F","AXX3F","Amphenol Female XLR 3 Inline, Chuck style cable clamp, Nickel (NEW second generation)","2575","R 91.00"
"AMP-EP-5-12","EP-5-12","#Amphenol EP Male inline, machined contacts, metal shell","4","R 347.00"
"AMP-EP-5-13P","EP-5-13P","#Amphenol EP Female chassis mount connector, round flange,machined","39","R 401.00"
"AMP-HP3F","HP3F","Amphenol HP Blue 3 pole inline","302","R 143.00"
"AMP-HP3FG","HP3FG","Amphenol HP Grey 3 pole inline","163","R 141.00"
"AMP-HP3MD","HP3MD","Amphenol 3 pole, Chassis connector D type keyed for power-in","88","R 62.00"
"AMP-HP3MDG","HP3MDG","Amphenol 3 pole Grey Chassis connector D type keyed for power-out","47","R 62.00"
"AMP-HPT3F","HPT3F","Amphenol HPT-3-F outlet inline","0","R 206.00"
"AMP-HPT3FD","HPT3F","Amphenol HPT-3-FD outlet panelmount","50","R 219.00"
"AMP-HPT3M","HPT3M","Amphenol HPT-3-M inlet inline","0","R 197.00"
"AMP-KM2P","KM2P","Amphenol 3.5mm Mono Phone plug, Diecast Shell, Satin finish","109","R 63.00"
"AMP-KS3P","KS3P","Amphenol 3.5mm Stereo Phone plug, Diecast Shell, Satin finish","305","R 71.00"
"AMP-KS3PB","KS3PB","Amphenol 3.5mm Stereo Phone plug, Diecast Shell, Black finish","0","R 73.00"
"AMP-RJX8FD5T","RJX8FD5T","Amphenol XLRnet D Type Feed through CAT5E","0","R 280.00"
"AMP-RJX8FD6I","RJX8FD6I","Amphenol XLRnet D Type IDC punch down terminals CAT6","132","R 299.00"
"AMP-RJX8M","RJX8M","Amphenol XLRnet, XLR cable plug housing to suit preassembled RJ45, Nickel","7","R 108.00"
"AMP-SP2F","SP2F","Amphenol Speaker Plug 2 Pole","705","R 122.00"
"AMP-SP2MD","SP2MD","Amphenol Speaker Plug 2 pole, D flange, Thru holes, Solder tabs","0","R 50.00"
"AMP-SP4F","SP4F","Amphenol Speaker Plug 4 Pole","977","R 145.00"
"AMP-SP4FL","SP4FL","Amphenol 4 pole, Cable connector shell, Blue sleeve, PG Gland, Black","0","R 226.00"
"AMP-SP4FN","SP4FN","Amphenol Speaker Plug 4 Pole Metal nickel shell","0","R 204.00"
"AMP-SP4FNSG","SP4FNSG","Amphenol Speaker Plug 4 Pole Metal nickel shell PG Gland","17","R 224.00"
"AMP-SP4MC","SP4MC","Amphenol Speaker panel mount 4 Pole connector (round, solder termination)","253","R 140.00"
"AMP-SP4MD","SP4MD","Amphenol Speaker Plug 4 pole, D flange, Thru holes, Solder tabs","0","R 61.00"
"AMP-TM1P","TM1P","Amphenol SwitchPlug 1/4" (6.35mm) Mono Phone plug","0","R 272.00"
"AMP-TM1RJ","TM1RJ","Amphenol SwitchPlug 1/4" (6.35mm) Mono Phone plug, Right angle","57","R 305.00"
"AMP-TM2P","TM2P","Amphenol Mono Jack diecast, Thermoplastic Back, Satin finish","606","R 106.00"
"AMP-TM2PB","TM2PB","Amphenol Mono Jack diecast, Thermoplastic Back, Black finish","0","R 108.00"
"AMP-TM2PBJ","TM2PBJ","Amphenol Mono Jack diecast, Thermoplastic back, black, L JAWS","0","R 108.00"
"AMP-TM2PJ","TM2PJ","Amphenol Mono Jack diecast, Thermoplastic Back, Satin, L JAWS","0","R 106.00"
"AMP-TS3P","TS3P","Amphenol Stereo Jack Thermo Back Sil Case","730","R 112.00"
"AMP-TS3PB","TS3PB","Amphenol Stereo Jack Thermo Back Blck Case","0","R 113.00"
"AMP-TS3PBJ","TS3PBJ","Amphenol Stereo Jack Thermo Back Blck Case Large Clamp","0","R 113.00"
"AMP-TS3PJ","TS3PJ","Amphenol Stereo Jack Thermo Back Sil Case Large Clamp","0","R 112.00"
"APT-AL-DL062FR","AL-DL062FR","Appotronics 0.62:1 Short Throw Fixed Lens (for D Series)","0","R 20,513.00"
"APT-AL-DL080FR","AL-DL080FR","Appotronics 0.80:1 Short Throw Fixed Lens (for D Series)","0","R 20,513.00"
"APT-AL-DL123MA","AL-DL123MA","Appotronics 1.23-1.97:1 Zoom (Standard) Lens (for D Series)","0","R 6,411.00"
"APT-AL-DU735A","AL-DU735A","Appotronics D Pro Series 7300lm, 1920*1080, 1-chip DLP ALPD, Powered Lens Shift, 3D-sync,Geometric Keystone, incl 1.23-1.97:1 standard zoom lens","0","R 112,180.00"
"APT-AL-DU835A","AL-DU835A","Appotronics D Pro Series 8300lm, 1920*1080, 1-chip DLP ALPD, Powered Lens Shift, 3D-sync,Geometric Keystone, incl 1.23-1.97:1 standard zoom lens","0","R 123,718.00"
"APT-AL-DU935A","AL-DU935A","Appotronics D Pro Series 9300lm, 1920*1080, 1-chip DLP ALPD, Powered Lens Shift, 3D-sync,Geometric Keystone, incl 1.23-1.97:1 standard zoom lens","0","R 131,411.00"
"APT-AL-MK650A","AL-MK650A","Appotronics M Series 6500lm, 3840*2160, Powered Interchangeable Lens, AI PQ, Advanced geo-corrections, incl 1.0-1.6:1 standard zoom lens","0","R 108,975.00"
"APT-AL-MK750A","AL-MK750A","Appotronics M Series 7500lm, 3840*2160, Powered Interchangeable Lens, AI PQ, Advanced geo-corrections, incl 1.0-1.6:1 standard zoom lens","1","R 118,590.00"
"APT-AL-ML050FR","AL-ML050FR","Appotronics 0.5:1 Short Throw Zoom (for M Series)","0","R 13,142.00"
"APT-AL-ML070FR","AL-ML070FR","Appotronics 0.7-0.9:1 Short Throw Zoom Lens (for M Series)","0","R 22,436.00"
"APT-AL-ML100MA","AL-ML100MA","Appotronics 1.00-1.60:1 Zoom (standard) Lens (for M Series)","1","R 6,411.00"
"APT-AL-ML154MA","AL-ML154MA","Appotronics 1.54-2.48:1 Long Throw Zoom Lens (for M Series)","0","R 21,795.00"
"APT-AL-MU525A","AL-MU525A","Appotronics M Series 5200lm, 1920*1200, 1-chip DLP, Powered Interchangeable Lens, 3D Sync In/Out, Geometric keystone, incl 1.0-1.6:1 standard zoom lens","0","R 67,308.00"
"APT-AL-MU625A","AL-MU625A","Appotronics M Series 6200lm, 1920*1200, 1-chip DLP, Powered Interchangeable Lens, 3D Sync In/Out, Geometric keystone, incl 1.0-1.6:1 standard zoom lens","0","R 73,718.00"
"APT-AL-SK11KAP","AL-SK11KAP","Appotronics S Pro Series 11000lm, 3840*2400, RGBX Laser, 4K+ Resolution, Duo Channel Signal Backup (body only)","0","R 480,770.00"
"APT-AL-SK13KAP","AL-SK13KAP","Appotronics S Pro Series 13000lm, 3840*2400, RGBX Laser, 4K+ Resolution, Duo Channel Signal Backup (body only)","0","R 570,513.00"
"APT-AL-SK15KAP","AL-SK15KAP","Appotronics S Pro Series 15000lm, 3840*2400, RGBX Laser, 4K+ Resolution, Duo Channel Signal Backup (body only)","0","R 660,257.00"
"APT-AL-SK20KAP","AL-SK20KAP","Appotronics S Pro Series 20000lm, 3840*2400, RGBX Laser, 4K+ Resolution, Duo Channel Signal Backup (body only)","0","R 1,076,924.00"
"APT-AL-SU11KAP","AL-SU11KAP","Appotronics S Pro Series 11000lm, 1920*1200, RGBX Laser, Duo Channel Signal Backup, Advanced Geo-Correction (body only)","0","R 320,513.00"
"APT-AL-SU13KAP","AL-SU13KAP","Appotronics S Pro Series 13000lm, 1920*1200, RGBX Laser, Duo Channel Signal Backup, Advanced Geo-Correction (body only)","0","R 410,257.00"
"APT-AL-SU15KAP","AL-SU15KAP","Appotronics S Pro Series 15000lm, 1920*1200, RGBX Laser, Duo Channel Signal Backup, Advanced Geo-Correction (body only)","0","R 493,590.00"
"APT-AL-SU20KAP","AL-SU20KAP","Appotronics S Pro Series 20000lm, 1920*1200, RGBX Laser, Duo Channel Signal Backup, Advanced Geo-Correction (body only)","0","R 929,488.00"
"APT-AL-TL089SZ","AL-TL089SZ","Appotronics 0.89-1.29:1 Short Throw Zoom Lens (for T Series)","0","R 320,513.00"
"APT-AL-TL128MA","AL-TL128MA","Appotronics 1.28-1.81:1 Standard Zoom Lens (for T Series)","0","R 141,026.00"
"APT-AL-TL160LZ","AL-TL160LZ","Appotronics 1.6-2.29:1 Long Throw Zoom Lens (for T Series)","0","R 115,385.00"
"APT-AL-TL200LZ","AL-TL200LZ","Appotronics 2.00-4.00:1 Long Throw Zoom Lens (for T Series)","0","R 182,693.00"
"APT-AL-TL366LZ","AL-TL366LZ","Appotronics 3.66-5.94:1 Long Throw Zoom Lens (for T Series)","0","R 182,693.00"
"APT-AL-TU25KA","AL-TU25KA","Appotronics T Pro Series 25000lm, 1920*1200, 3-chip DLP, P3 Color, 4K Decoding, Duo Channel Signal Backup (body only)","0","R 1,282,052.00"
"APT-AL-TU34KA","AL-TU34KA","Appotronics T Pro Series 34000lm, 1920*1200, 3-chip DLP, P3 Color, 4K Decoding, Duo Channel Signal Backup (body only)","0","R 1,794,872.00"
"APT-AL-XL070FR","AL-XL070FR","Appotronics 0.70-0.85:1 Short Throw Zoom Lens (for S Pro Series )","0","R 105,770.00"
"APT-AL-XL085FR","AL-XL085FR","Appotronics 0.85-1.11:1 Short Throw Zoom Lens (for S Pro Series )","0","R 105,770.00"
"APT-AL-XL110MA","AL-XL110MA","Appotronics 1.1-1.5:1 Mid-range Zoom Lens (for S Pro Series )","0","R 80,129.00"
"APT-AL-XL150MA","AL-XL150MA","Appotronics 1.5-2.4:1 Mid-range Zoom Lens (for S Pro Series )","0","R 73,718.00"
"APT-AL-XL240LA","AL-XL240LA","Appotronics 2.4-3.8:1 Long Throw Zoom Lens (for S Pro Series )","0","R 83,334.00"
"ATL-AT-AVA-EX100CE-BP-KIT","AT-AVA-EX100CE-BP-KIT","Atlona Avance 4K/UHD extended distance HDMI Transmitter and Receiver Kit with RS-232 and IR pass-through and bi-directional power","0","R 18,041.00"
