"FOR-XPRO21-HB","XPRO21-HB","Fortinge 21" HIGH BRIGHTNESS TELEPROMPTER MONITOR","0","R 66,325.00"
"FOR-XPRO21-HB-SDI","XPRO21-HB-SDI","Fortinge 21" HIGH BRIGHTNESS TELEPROMPTER MONITOR with SDI IN/OUT","0","R 76,825.00"
"FOR-XPRO21-SDI","XPRO21-SDI","Fortinge 21" TELEPROMPTER MONITOR with SDI IN/OUT","0","R 64,925.00"
"GRA-GSA6131B","GSA6131B","Gravity SA 6131 B - Monitor Mount Tabletop-Mount Swivel Arm","2","R 2,870.00"
"HEL-NIT21-BLK","NIT21-BLK","Nitto Electrical Insulation Tape (Type21) 0.2x18mmx20m, black","1103","R 32.00"
"HEL-NIT21-BLU","NIT21-BLU","Nitto Electrical Insulation Tape (Type21) 0.2x18mmx20m, blue","0","R 32.00"
"HEL-NIT21-GRN","NIT21-GRN","Nitto Electrical Insulation Tape (Type21) 0.2x18mmx20m, green","347","R 32.00"
"HEL-NIT21-RED","NIT21-RED","Nitto Electrical Insulation Tape (Type21) 0.2x18mmx20m, red","318","R 32.00"
"HEL-NIT21-WHT","NIT21-WHT","Nitto Electrical Insulation Tape (Type21) 0.2x18mmx20m, white","258","R 32.00"
"HEL-NIT21-YEL","NIT21-YEL","Nitto Electrical Insulation Tape (Type21) 0.2x18mmx20m, yellow","8","R 32.00"
"HEL-T120RBK","T120RBK","Hellermann Tyton Cable Tie Insulok 390 x 7.8mm Black - Pack Qty: 50","49","R 271.00"
"HEL-T120RBKFS","T120RBKFS","Hellermann Tyton Cable Tie Insulok 390 x 7.8mm Straight Tail - Pack Qty: 50","0","R 271.00"
"HEL-T120RBKP","T120RBKP","Hellermann Tyton Cable Tie Insulok 390 x 7.8mm Black Polypropylene - Pack Qty: 50","0","R 308.00"
"HEL-T120RNT","T120RNT","Hellermann Tyton Cable Tie Insulok 390 x 7.8mm Natural - Pack Qty: 50","16","R 281.00"
"HEL-T120SBK","T120SBK","Hellermann Tyton Cable Tie Insulok 278 x 7.8mm Black - Pack Qty: 100","0","R 420.00"
"HEL-T120SNT","T120SNT","Hellermann Tyton Cable Tie Insulok 278 x 7.8mm Natural - Pack Qty: 100","0","R 453.00"
"HEL-T18RBK","T18RBK","Hellermann Tyton Cable Tie Insulok 100x2.5mm Black - Pack Qty: 100","0","R 35.00"
"HEL-T18RNT","T18RNT","Hellermann Tyton Cable Tie Insulok 100x2.5mm Natural - Pack Qty: 100","0","R 36.00"
"HEL-T30RBK","T30RBK","Hellermann Tyton Cable Tie Insulok 148 x 3.5mm Black - Pack Qty: 100","0","R 68.00"
"HEL-T30RBKP","T30RBKP","Hellermann Tyton Cable Tie Insulok 148 x 3.5mm Polypropylene - Pack Qty: 100","0","R 75.00"
"HEL-T30RNT","T30RNT","Hellermann Tyton Cable Tie Insulok 148 x 3.5mm Natural - Pack Qty: 100","0","R 73.00"
"HEL-T50IBK","T50IBK","Hellermann Tyton Cable Tie Insulok 305 x 4.7mm Black - Pack Qty: 100","0","R 197.00"
"HEL-T50IBKP","T50IBKP","Hellermann Tyton Cable Tie Insulok 305 x 4.7mm Black Polypropylene - Pack Qty: 100","7","R 214.00"
"HEL-T50INT","T50INT","Hellermann Tyton Cable Tie Insulok 305 x 4.7mm Natural - Pack Qty: 100","0","R 192.00"
"HEL-T50LBK","T50LBK","Hellermann Tyton Cable Tie Insulok 392 x 4.7mm Black - Pack Qty: 100","0","R 235.00"
"HEL-T50LNT","T50LNT","Hellermann Tyton Cable Tie Insulok 392 x 4.7mm Natural - Pack Qty: 100","19","R 263.00"
"HEL-T50RBK","T50RBK","Hellermann Tyton Cable Tie Insulok 198 x 4.7mm Black - Pack Qty: 100","0","R 114.00"
"HEL-T50RBKP","T50RBKP","Hellermann Tyton Cable Tie Insulok 198 x 4.7mm Black Polypropylene - Pack Qty: 100","0","R 125.00"
"HEL-T50RNT","T50RNT","Hellermann Tyton Cable Tie Insulok 198 x 4.7mm Natural - Pack Qty: 100","0","R 128.00"
"HER-BS010BB","PSABX0000180","Hercules Stands BS010BB Table Music Stand","12","R 314.00"
"HER-BS020BB","PSABX0000177","Hercules Stands BS020BB Compact Music Stand","0","R 314.00"
"HER-BS030BB","PSABX0000149","Hercules Stands BS030BB Compact Music Stand","10","R 314.00"
"HER-BS050B","PSABX0000069","Hercules Stands BS050B Three-section Music Stand w/ Bag","86","R 446.00"
"HER-BS100B","PSABX0000059","Hercules Stands BS100B Two-section EZ Glide Music Stand","0","R 557.00"
"HER-BS118BB","PSABX0000077","Hercules Stands BS118BB Three-section EZ Grip Music Stand w/ Bag","43","R 689.00"
"HER-BS200BCPLUS","PSABX0000158","Hercules Stands BS200BC PLUS Symphony Stand BS200B x12 pcs and Stand Cart BSC800 x1 pc","0","R 13,518.00"
"HER-BS200BPLUS","PSABX0000155","Hercules Stands BS200B PLUS Stage Series EZ Grip Symphony Stand","5","R 821.00"
"HER-BS223B","PSABX0000161","Hercules Stands BS223B Stage Series Symphony Stand","0","R 1,084.00"
"HER-BS243B","PSABX0000164","Hercules Stands BS243B Stage Series Fourscore Stand","0","R 1,570.00"
"HER-BS301B","PSABX0000092","Hercules Stands BS301B EZ Clutch Tripod Orchestra Stand w/ Foldable Desk","1","R 1,459.00"
"HER-BS311B","PSABX0000082","Hercules Stands BS311B EZ Clutch Tripod Orchestra Stand w/ Perforated Foldable Desk","36","R 1,459.00"
"HER-BS408BPLUS","PSABX0000170","Hercules Stands BS408B PLUS Orchestra Stand, Solid Desk","2","R 1,570.00"
"HER-BS418BPLUS","PSABX0000173","Hercules Stands BS418B PLUS Orchestra Stand, Perforated Desk","24","R 1,570.00"
"HER-BSB001","PSTZX0000002","Hercules Stands BSB001 Orchestra Stand Bag","20","R 436.00"
"HER-BSB002","PSTZX0000006","Hercules Stands BSB002 Music Stand Bag for BS100B","50","R 203.00"
"HER-BSC800","PSABX0000001","Hercules Stands BSC800 Music Stand Cart for EZ Grip Symphony Stand(BS200B)","12","R 5,276.00"
"HER-DG107B","PSACX0000026","Hercules Stands DG107B Universal Podcast Mic and Camera Arm Stand","45","R 942.00"
"HER-DG137B","PSACX0000029","Hercules Stands DG137B Multi Mount","14","R 487.00"
"HER-DG207B","PSACX0000023","Hercules Stands DG207B Universal Smartphone Holder","104","R 476.00"
"HER-DG307B","PSACX0000020","Hercules Stands DG307B 2-in-1 Tablet and Phone Holder","33","R 811.00"
"HER-DG307B-FS1","","Hercules DG307B-FS1 Tablet and Smartphone/Microphone Floor Stand","0","R 669.00"
"HER-DG307B-TS2","","Hercules DG307B-TS2 Tabletop Tablet and Smartphone Stand, Tripod","2","R 912.00"
"HER-DG327B","PSACX0000041","Hercules Stands DG327B Tablet Arm Holder","35","R 1,013.00"
"HER-DG400BB","PSACX0000005","Hercules Stands DG400BB Laptop Stand","36","R 1,367.00"
"HER-DS410B","PSADX0000045","Hercules Stands DS410B TravLite Trumpet Stand","44","R 355.00"
"HER-DS420B","PSADX0000049","Hercules Stands DS420B TravLite Trombone Stand","41","R 973.00"
"HER-DS431B","PSADX0000106","Hercules Stands DS431B TravLite Alto SAX Stand","33","R 699.00"
"HER-DS432B","PSADX0000110","Hercules Stands DS432B TravLite Tenor SAX Stand","19","R 699.00"
"HER-DS440B","PSADX0000114","Hercules Stands DS440B TravLite Clarinet Stand","36","R 406.00"
"HER-DS460B","PSADX0000118","Hercules Stands DS460B TravLite Flute Stand","34","R 406.00"
"HER-DS461B","PSADX0000122","Hercules Stands DS461B TravLite Low-B Flute Stand","23","R 446.00"
"HER-DS501B","PSTZX0000010","Hercules Stands DS501B Peg for Trumpet/Cornet","6","R 183.00"
"HER-DS503B","PSTZX0000013","Hercules Stands DS503B Peg for Soprano Sax/Flugelhorn","35","R 183.00"
"HER-DS504B","PSTZX0000016","Hercules Stands DS504B Peg for Piccolo","8","R 173.00"
"HER-DS510BB","PSADX0000037","Hercules Stands DS510BB Trumpet Stand w/ Bag","45","R 416.00"
"HER-DS513BB","PSADX0000041","Hercules Stands DS513BB 2 Trumpets/Cornets and 1 Flugelhorn Stand w/ Bag","6","R 588.00"
"HER-DS520B","PSADX0000076","Hercules Stands DS520B Trombone Stand","18","R 608.00"
"HER-DS530BB","PSADX0000080","Hercules Stands DS530BB Alto/Tenor SAX Stand w/ Bag","27","R 487.00"
"HER-DS531BB","PSADX0000084","Hercules Stands DS531BB Soprano SAX/ Flugelhorn Stand w/ Bag","56","R 416.00"
"HER-DS532BB","PSADX0000088","Hercules Stands DS532BB 1 Alto/Tenor SAX and 1 Clarinet/Flute Stand w/ Bag","10","R 557.00"
"HER-DS533BB","PSADX0000091","Hercules Stands DS533BB 1 Alto/Tenor SAX and 1 Soprano SAX Stand w/ Bag","11","R 557.00"
"HER-DS535B","PSADX0000094","Hercules Stands DS535B Baritone SAX Stand","13","R 790.00"
"HER-DS536B","PSADX0000098","Hercules Stands DS536B 1 Baritone SAX and 1 Alto/Tenor SAX Stand","9","R 1,074.00"
"HER-DS537B","PSADX0000141","Hercules Stands DS537B Duo Alto/Tenor SAX Stand","9","R 1,033.00"
"HER-DS538B","PSADX0000145","Hercules Stands DS538B Duo Alto/Tenor SAX Stand w/ 2 Clarinet/Flute pegs and 1 Soprano SAX peg","8","R 1,317.00"
"HER-DS543BB","PSADX0000102","Hercules Stands DS543BB 2 Clarinets/Flutes and 1 Piccolo Stand w/ Bag","12","R 517.00"
"HER-DS550BB","PSADX0000125","Hercules Stands DS550BB French Horn Stand w/ Bag","16","R 476.00"
"HER-DS551B","PSADX0000129","Hercules Stands DS551B Sousaphone Stand","10","R 1,459.00"
"HER-DS552B","PSADX0000133","Hercules Stands DS552B Tuba/Euphonium Stand","16","R 1,317.00"
"HER-DS553B","PSADX0000137","Hercules Stands DS553B Tuba/Euphonium Performer Stand","10","R 1,266.00"
"HER-DS561B","PSADX0000152","Hercules Stands DS561B Bassoon/Bass Clarinet Stand","6","R 1,114.00"
"HER-DS562BB","PSADX0000156","Hercules Stands DS562BB Alto Flute Stand w/ Bag","27","R 466.00"
"HER-DS571BB","PSAGX0000178","Hercules Stands DS571BB TravLite Violin/Viola Stand w/ Bag","53","R 730.00"
"HER-DS580B","PSAGX0000182","Hercules Stands DS580B Auto Grip Cello Stand","10","R 1,084.00"
"HER-DS590B","PSAGX0000187","Hercules Stands DS590B Double Bass Stand","1","R 1,367.00"
"HER-DS602B","PSTZX0000024","Hercules Stands DS602B Peg for Deluxe Clarinet/Flute","9","R 173.00"
"HER-DS630BB","PSADX0000176","Hercules Stands DS630BB Auto Grip Alto/Tenor SAX Stand w/ Bag","39","R 578.00"
"HER-DS640BB","PSADX0000180","Hercules Stands DS640BB (GENERAL),Deluxe Flute/Clarinet/Oboe Stand w/ Bag","23","R 416.00"
"HER-DS730B","PSADX0000184","Hercules Stands DS730B Auto Grip Alto/Tenor SAX Stand (Tall)","35","R 871.00"
"HER-DS753BB","PSADX0000222","Hercules Stands DS753BB 2-Way Low Brass Stand","0","R 1,874.00"
"HER-DS800B","PSASX0000039","Hercules Stands DS800B Percussion Table Stand","10","R 1,600.00"
"HER-DSP57SB","PSAPX0000005","Hercules Stands DSP57SB Auto Grip Violin Hanger for Slat Wall (w/ 16 mm Insertion)","30","R 355.00"
"HER-DSP57WB","PSAPX0000008","Hercules Stands DSP57WB Auto Grip Violin Hanger for Wall Mounting w/ Wood Base","31","R 355.00"
"HER-FS100B","PSAZX0000009","Hercules Stands FS100B Foot Rest","46","R 254.00"
"HER-GS200B","PSAGX0000122","Hercules Stands GS200B EZ Pack Guitar Stand","105","R 335.00"
"HER-GS301B","PSAGX0000114","Hercules Stands GS301B TravLite Acoustic Guitar Stand","80","R 375.00"
"HER-GS302B","PSAGX0000118","Hercules Stands GS302B TravLite Electric Guitar Stand","98","R 375.00"
"HER-GS303B","PSAGX0000108","Hercules Stands GS303B TravLite Folk Instrument Stand","14","R 375.00"
"HER-GS401BB","PSAGX0000067","Hercules Stands GS401BB Mini Acoustic Guitar Stand w/ Bag","58","R 476.00"
"HER-GS402BB","PSAGX0000071","Hercules Stands GS402BB Mini Electric Guitar Stand w/ Bag","43","R 476.00"
"HER-GS405B","PSAGX0000098","Hercules Stands GS405B ShokSafe Guitar Stand","18","R 730.00"
"HER-GS412BPLUS","PSAGX0000200","Hercules Stands GS412B PLUS Auto Grip Guitar Stand w/ Foldable Backrest","78","R 730.00"
"HER-GS414BLT","GS414BLT","#Hercules Stands GS414BLT PLUS Limited Edition Single Guitar Stand","1","R 1,019.00"
"HER-GS414BPLUS","PSAGX0000196","Hercules Stands GS414B PLUS Auto Grip Guitar Stand w/ SFF on Legs","116","R 730.00"
"HER-GS415BPLUS","PSAGX0000202","Hercules Stands GS415B PLUS Auto Grip Guitar Stand w/ Foldable Yoke","6","R 750.00"
"HER-GS422BPLUS","PSAGX0000204","Hercules Stands GS422B PLUS Auto Grip Duo Guitar Stand w/ Foldable Backrest","18","R 1,205.00"
"HER-GS432BPLUS","PSAGX0000206","Hercules Stands GS432B PLUS Auto Grip Tri Guitar Stand w/ Foldable Backrest","4","R 1,570.00"
"HER-GS523B","PSAGX0000125","Hercules Stands GS523B 3-pc Guitar Display Rack","25","R 1,509.00"
"HER-GS523BPLUS","PSAGX0000244","Hercules GS523BPLUS Guitar Display Rack For 3 Guitars","10","R 1,773.00"
"HER-GS525B","PSAGX0000129","Hercules Stands GS525B 5-pc Guitar Display Rack","16","R 1,803.00"
"HER-GS525BPLUS","PSAGX0000247","Hercules Stands GS525B PLUS 5-pc Guitar Display Rack w/casters","12","R 2,076.00"
"HER-GS526BPLUS","PSAGX0000208","Hercules Stands GS526B PLUS 6-pc Auto Grip Guitar Stand","21","R 2,410.00"
"HER-GSB001","PSTZX0000037","Hercules Stands GSB001 Guitar Stand Bag","0","R 203.00"
"HER-GSP38WBKPLUS","PSAPX0000089","Hercules Stands GSP38WBK PLUS Auto Grip Guitar Hanger for Wall Mounting w/ Black Wood Base, Short Arm","53","R 294.00"
"HER-GSP38WBPLUS","PSAPX0000062","Hercules Stands GSP38WB PLUS Auto Grip Guitar Hanger for Wall Mounting w/ Wood Base, Short Arm","1825","R 294.00"
"HER-GSP38WBRPLUS","GSP38WBR PLUS","Hercules Stands GSP38WBR PLUS Auto Grip Guitar Hanger for Wall Mounting w/ Burgundy Red Wood Base, Short Arm","60","R 294.00"
"HER-GSP38WBWPLUS","PSAPX0000106","Hercules Stands GSP38WBW PLUS Auto Grip Guitar Hanger for Wall Mounting w/ Brown Wood Base, Short Arm","43","R 294.00"
"HER-GSP39SBPLUS","PSAPX0000064","Hercules Stands GSP39SB PLUS Auto Grip Guitar Hanger for Slat Wall, Short Arm (with 16 mm insertion)","72","R 294.00"
"HER-GSP39WBPLUS","PSAPX0000077","Hercules Stands GSP39WB PLUS Auto Grip Guitar Hanger for Wall Mounting w/ Steel Base, Short Arm","1715","R 294.00"
"HER-GSP402SB","PSAPX0000127","Hercules Stands GSP402SB 2 Guitar Wall Rack","0","R 993.00"
"HER-GSP403SB","PSAPX0000130","Hercules Stands GSP403SB 3 Guitar Wall Rack","0","R 1,692.00"
"HER-GSP40BPLUS","PSAPX0000069","Hercules Stands GSP40B PLUS Auto Grip Guitar Hanger for Pegboard","24","R 294.00"
"HER-GSP40HBPLUS","PSAPX0000071","Hercules Stands GSP40HB PLUS Auto Grip Guitar Hanger for Grid Wall","0","R 294.00"
"HER-GSP40SBPLUS","PSAPX0000065","Hercules Stands GSP40SB PLUS Auto Grip Guitar Hanger for Slat Wall (with 16 mm insertion)","24","R 294.00"
"HER-GSP40WBPLUS","PSAPX0000067","Hercules Stands GSP40WB PLUS Auto Grip Guitar Hanger for Wall Mounting","57","R 294.00"
"HER-GSP41SBPLUS","PSAPX0000074","Hercules Stands GSP41SB PLUS Auto Grip Guitar Hanger for Slat Wall (with 13 mm insertion)","0","R 294.00"
"HER-GSP50HBPLUS","PSAPX0000098","Hercules Stands GSP50HB PLUS Auto Grip Guitar Hanger for All-grids","0","R 466.00"
"HER-GSP50SBPLUS","PSAPX0000097","Hercules Stands GSP50SB PLUS Auto Grip Guitar Hanger for All-slats (w/ 16 mm Insertion)","0","R 466.00"
"HER-H24P01","","Hercules H24P01 Multi Purpose Tray","36","R 189.00"
"HER-H24P02","","Hercules H24P02 Cup Holder","44","R 189.00"
"HER-HA100","PSTZX0000020","Hercules Stands HA100 Mute Holder for 4 Mutes","0","R 395.00"
"HER-HA101S","PSTZX0000043","Hercules Stands HA101S AGS Guitar Stand Lock (1 Lock, 2 Keys)","0","R 82.00"
"HER-HA103","PSTZX0000061","Hercules Stands HA103 Music Stand Tray","12","R 254.00"
"HER-HA201","PSTZX0000028","Hercules Stands HA201 AGS Guitar Stand Lock (12 Locks, 3 Keys)","4","R 719.00"
"HER-HA205","PSTZX0000030","Hercules Stands HA205 Extension Yoke for Guitar Display Rack(GS523B/525B)","111","R 122.00"
"HER-HA206","PSTZX0000035","Hercules Stands HA206 Guitar Maintenance Neck Cradle","0","R 223.00"
"HER-HA301","PSTZX0000045","Hercules Stands HA301 Narrow Instrument Neck Adjustment for AGS Yoke","0","R 82.00"
"HER-HA700","PSTAX0000060","Hercules Stands HA700 Guitar Strap/Headphone Holder","57","R 193.00"
"HER-KB200B","PSAJX0000019","Hercules Stands KB200B EZ Height Adjustment Keyboard Bench","8","R 2,147.00"
"HER-KS100B","PSAKX0000050","Hercules Stands KS100B EZ-STEP Single X Keyboard Stand","53","R 750.00"
"HER-KS110B","PSAKX0000037","Hercules Stands KS110B EZ-LOK Single X Keyboard Stand","6","R 871.00"
"HER-KS118B","PSAKX0000046","Hercules Stands KS118B TravLite Keyboard Stand","17","R 1,054.00"
"HER-KS120B","PSAKX0000042","Hercules Stands KS120B EZ-LOK Double X Keyboard Stand","60","R 1,054.00"
"HER-KS210B","PSAKX0000053","Hercules Stands KS210B EZ-LOK Double Tier X Keyboard Stand","7","R 1,833.00"
"HER-KS400B","PSAKX0000058","Hercules Stands KS400B AutoLock Z Keyboard Stand","19","R 2,208.00"
"HER-KS410B","PSAKX0000062","Hercules Stands KS410B AutoLock Z Keyboard Stand w/ Tier","20","R 3,069.00"
"HER-KSB001","PSTZX0000040","Hercules Stands KSB001 Carrrying Bag for TravLite Keyboard Stand","81","R 446.00"
"HER-LS700B","PSALX0000008","Hercules Stands LS700B Gear Up Lighting Stand","9","R 5,084.00"
"HER-MH100B","PSTAX0000010","Hercules Stands MH100B EZ Mic. Clip (Accept Mic. Size 20~35mm O/D)","97","R 132.00"
"HER-MH101B","PSTAX0000013","Hercules Stands MH101B EZ Mic. Holder (Accept Mic. Size 25~30mm O/D)","137","R 132.00"
"HER-MH200B","PSAMX0000222","Hercules Stands MH200B Pop Filter","151","R 314.00"
"HER-MS100BPLUS","PSAMX0000250","Hercules Stands MS100B PLUS Tabletop Microphone Stand, Round Base w/ EZ Grip","59","R 557.00"
"HER-MS120B","PSAMX0000031","Hercules Stands MS120B Low profile H Base Mic. Stand w/ Telescopic Boom","39","R 811.00"
"HER-MS120BPRO","PSAMX0000237","Hercules Stands MS120B PRO Bass Drum Microphone Stand","81","R 942.00"
"HER-MS201BPLUS","PSAMX0000225","Hercules Stands MS201B PLUS One-Handed EZ Grip H Base Microphone Stand","27","R 952.00"
"HER-MS202B","PSAMX0000050","Hercules Stands MS202B Stage Series Quick Turn H Base Mic. Stand","30","R 547.00"
"HER-MS300BPLUS","PSAMX0000247","Hercules Stands MS300B PLUS Tabletop Microphone Stand, Tripod w/ Tilting Shaft and EZ Grip","55","R 557.00"
"HER-MS401BPLUS","PSAMX0000228","Hercules Stands MS401B PLUS Transformer Mic. Stand w/ Tilting Shaft","18","R 1,054.00"
"HOL-SOLC1-4S","SOLC1-4S","Hollyland Solidcom C1-4S Full-Duplex Wireless DECT Intercom System with 4 Headsets (1.9 GHz) (1 Master+3 Remote)","5","R 18,345.00"
"HOL-SOLC1-6S","SOLC1-6S","Hollyland Solidcom C1-6S Full-Duplex Wireless DECT Intercom System with 6 Headsets (1.9 GHz) (1 Master+5 Remote)","2","R 26,313.00"
"HOL-SOLC1-8S","SOLC1-8S","Hollyland Solidcom C1-8S Full-Duplex Wireless DECT Intercom System with 8 Headsets (1.9 GHz) (1 Master+7 Remote)","1","R 34,652.00"
"HOL-SOLC1-HUB","SOLC1-HUB","Hollyland Solidcom C1 HUB Base for DECT Intercom System (1.9 GHz)","0","R 37,765.00"
"HOL-SOLC1-HUB8S","SOLC1-HUB8S","Hollyland Solidcom C1-HUB8S Full-Duplex Wireless DECT Intercom System with 9 Headsets and HUB Base (1.9 GHz)","0","R 84,460.00"
"HOL-SOLC1-PRO-2S","SOLC1-PRO-2S","Hollyland Solidcom C1 Pro-2S Full-Duplex ENC Wireless Intercom System with 2 Headsets (1.9 GHz)","0","R 14,417.00"
"HOL-SOLC1-PRO-3S","SOLC1-PRO-3S","Hollyland Solidcom C1 Pro-8S Full-Duplex ENC Wireless Intercom System with 3 Headsets (1.9 GHz)","0","R 21,755.00"
"HOL-SOLC1-PRO-4S","SOLC1-PRO-4S","Hollyland Solidcom C1 Pro-4S Full-Duplex ENC Wireless Intercom System with 4 Headsets (1.9 GHz)","5","R 28,870.00"
"HOL-SOLC1-PRO-4S-DH","SOLC1-PRO-4S-DH","Hollyland Solidcom C1 Pro-4S-DH Full-Duplex ENC Wireless Intercom System with 4 Double-Ear Headsets (1.9 GHz)","3","R 31,094.00"
"HOL-SOLC1-PRO-5S","","Hollyland Solidcom C1 Pro-5S Full-Duplex ENC Wireless Intercom System with 5 Headsets (1.9 GHz)","0","R 36,208.00"
"HOL-SOLC1-PRO-6S","SOLC1-PRO-6S","Hollyland Solidcom C1 Pro-6S Full-Duplex ENC Wireless Intercom System with 6 Headsets (1.9 GHz)","2","R 43,324.00"
"HOL-SOLC1-PRO-8S","SOLC1-PRO-8S","Hollyland Solidcom C1 Pro-8S Full-Duplex ENC Wireless Intercom System with 8 Headsets (1.9 GHz)","4","R 56,665.00"
"HOL-SOLC1-PRO-DH01","SOLC1-PRO-DH01","Hollyland Solidcom C1 Pro Full-Duplex ENC Wireless Intercom Master Headset (Dual-Ear)","0","R 8,635.00"
"HOL-SOLC1-PRO-DH02","SOLC1-PRO-DH02","Hollyland Solidcom C1 Pro Full-Duplex ENC Wireless Intercom Remote Headset (Dual-Ear)","0","R 8,191.00"
"HOL-SOLC1-PRO-HUB","SOLC1-PRO-HUB","Hollyland Solidcom C1 Pro ENC Hub Base","1","R 39,988.00"
"HOL-SOLC1-PRO-HUB4S","SOLC1-PRO-HUB4S","Hollyland Solidcom C1 Pro-Hub4S ENC 5-Person Full-Duplex Wireless Intercom System with Hub (1.9 GHz)","1","R 73,342.00"
"HOL-SOLC1-PRO-HUB8S","SOLC1-PRO-HUB8S","Hollyland Solidcom C1 Pro-Hub8S ENC 9-Person Full-Duplex Wireless Intercom System with Hub (1.9 GHz)","0","R 100,025.00"
"HOL-SOLC1-PRO-RH-10S","SOLC1-PRO-RH-10S","Hollyland Solidcom C1 Pro Roaming Hub 10S - 10-Person Noise Cancelling Headset Intercom","0","R 204,312.00"
"HOL-SOLC1-PRO-RH-20S","SOLC1-PRO-RH-20S","Hollyland Solidcom C1 Pro Roaming Hub 20S - 20-Person Noise Cancelling Headset Intercom","0","R 270,798.00"
"HOL-SOLC1-PRO-RH-GM","SOLC1-PRO-RH-GM","Hollyland Solidcom C1 Pro Roaming Hub (G-Mount)","0","R 133,379.00"
"HOL-SOLC1-PRO-RH-VM","SOLC1-PRO-RH-VM","Hollyland Solidcom C1 Pro Roaming Hub (V-Mount)","0","R 133,379.00"
"HOL-SOLC1-PRO-SH01","SOLC1-PRO-SH01","Hollyland Solidcom C1 Pro Full-Duplex ENC Wireless Intercom Master Headset (Single-Ear)","0","R 8,191.00"
"HOL-SOLC1-PRO-SH02","SOLC1-PRO-SH02","Hollyland Solidcom C1 Pro Full-Duplex ENC Wireless Intercom Remote Headset (Single-Ear)","0","R 7,524.00"
"HOL-SOLC1-PRO-SH03","SOLC1-PRO-SH03","Hollyland Solidcom C1 Pro Single-Ear Wired Headset for HUB 3.5mm","0","R 3,336.00"
"HOL-SOLC1-SH01","SOLC1-SH01","Hollyland Solidcom C1 Full-Duplex Wireless DECT Single-Ear Master Headset (1.9 GHz)","0","R 7,412.00"
"HOL-SOLC1-SH02","SOLC1-SH02","Hollyland Solidcom C1 Full-Duplex Wireless DECT Single-Ear Remote Headset (1.9 GHz)","1","R 7,412.00"
"HOL-SOLC1-SH03","SOLC1-SH03","Hollyland Solidcom C1 Single-Ear Wired Headset for HUB 3.5mm","0","R 2,202.00"
"HOL-SOLH1-10S","","Hollyland Solidcom H1-10S 10-Person Noise-Cancelling Intercom System","0","R 578,099.00"
"HOL-SOLH1-ANT01","","Hollyland Solidcom H1 ANT01 Antenna","0","R 72,230.00"
"HOL-SOLH1-BPK01","","Hollyland Solidcom H1 BPK01 Beltpack","0","R 42,212.00"
"HOL-SOLH1-GEO-CS","","Hollyland Solidcom H1 Geo Central Station","0","R 216,764.00"
"HOL-SOLM1-4BP","SOLM1-4BP","Hollyland Solidcom M1-4BP Full-Duplex Wireless Intercom Solution - Station  with 4 Beltpacks and LEMO Headsets (1.9 GHz)","6","R 88,944.00"
"HOL-SOLM1-8BP","SOLM1-8BP","Hollyland Solidcom M1-8BP Full-Duplex Wireless Intercom Solution - Station  with 8 Beltpacks and LEMO Headsets (1.9 GHz)","2","R 155,652.00"
"HOL-SOLM1-BP","SOLM1-BP","Hollyland Solidcom M1 Beltpack for DECT Intercom System (1.9 GHz)","8","R 9,451.00"
"HOL-SOLM1-BS","SOLM1-BS","Hollyland Solidcom M1 Base Station, For Solidcom M1 Series","0","R 21,495.00"
"HOL-SOLM1-CB","SOLM1-CB","Hollyland Solidcom M1 Charging Base, For Solidcom M1 Series","0","R 4,077.00"
"HOL-SOLSE-2S","SOLSE-2S","Hollyland Solidcom SE-2S Wireless 2-Person Noise Cancelling Headset Intercom","2","R 6,857.00"
"HOL-SOLSE-3S","SOLSE-3S","Hollyland Solidcom SE-3S Wireless 3-Person Noise Cancelling Headset Intercom","1","R 10,192.00"
"HOL-SOLSE-4S","SOLSE-4S","Hollyland Solidcom SE-4S Wireless 4-Person Noise Cancelling Headset Intercom","5","R 13,750.00"
"HOL-SOLSE-4S-DH","","Hollyland Solidcom SE-4S Wireless 4-Person Noise Cancelling Headset Intercom - Double Ear Version","0","R 14,417.00"
"HOL-SOLSE-5S","","Hollyland Solidcom SE-5S Wireless 5-Person Noise Cancelling Headset Intercom","0","R 16,640.00"
"HOL-SOLSE-6S","SOLSE-6S","Hollyland Solidcom SE-6S Wireless 6-Person Noise Cancelling Headset Intercom","3","R 19,309.00"
"HOL-SOLSE-8S","SOLSE-8S","Hollyland Solidcom SE-8S Wireless 8-Person Noise Cancelling Headset Intercom","4","R 25,312.00"
"HOL-SOLSE-HS01","SOLSE-HS01","Hollyland Solidcom SE-Master Headset - Noise Cancelling Headset Intercom","1","R 3,744.00"
"HOL-SOLSE-HS02","SOLSE-HS02","Hollyland Solidcom SE-Remote Headset - Noise Cancelling Headset Intercom","3","R 3,521.00"
"HOL-SYS421-4TX","SYS421-4TX","#Hollyland Syscom 421-4TX, 4x Transmitter, 1x Receiver, 25x Antenna, 4x Arm Mounts","0","R 155,615.00"
"HOL-VEN-LIV-AIR","","Hollyland VenusLiv Air All-in-One Live Streaming Camera","4","R 10,822.00"
"HOL-VEN-LIV-V2","VEN-LIV-V2","Hollyland VenusLiv V2 All-in-One Live Streaming Camera (Black)","4","R 19,309.00"
"HOL-WTC-2C","","Hollyland Walkie-Talkie Converter Kit with 2-Core Walkie-Talkie Connection Cable","0","R 22,199.00"
"HOL-WTC-8C","","Hollyland Walkie-Talkie Converter Kit with 8-Core Walkie-Talkie Connection Cable","0","R 22,199.00"
"HOL-WTC-K","","Hollyland Walkie-Talkie Converter Kit with K-LEMO Walkie-Talkie Connection Cable","0","R 22,199.00"
"HOL-WTS-4TL","WTS-4TL","Hollyland Wireless Tally System (4 Tally Lights)","1","R 14,417.00"
"HOL-WTS-8TL","WTS-8TL","Hollyland Wireless Tally System (8 Tally Lights)","1","R 22,199.00"
"HOL-WTS-TL01","WTS-TL01","Hollyland Tally Light","0","R 2,187.00"
"HOL-WTS-TS01","WTS-TS01","Hollyland Tally Station","0","R 5,967.00"
"KON-18860-000-35","18860-000-35","Konig & Meyer Keyboard stand Spider Pro 18860 (black anodized)","0","R 8,803.00"
"KON-21336-000-55","21336-000-55","Konig & Meyer Distance rod 21336 (black)","0","R 1,267.00"
"KON-21337-000-55","21337-000-55","Konig & Meyer Distance rod 21337 (black)","51","R 1,270.00"
"KON-21338-000-55","21338-000-55","Konig & Meyer Distance rod with hand crank 21338 (black)","4","R 3,616.00"
"KON-21339-000-55","21339-000-55","Konig & Meyer Distance rod with hand crank 21339 (black)","15","R 3,716.00"
"KON-21420-000-55","21420-000-55","Konig & Meyer Speaker/Monitor stand 21420 (black)","28","R 1,378.00"
"KON-21435-009-55","21435-009-55","Konig & Meyer Speaker stand 21435 (black)","23","R 1,989.00"
"KON-21449-000-55","21449-000-55","Konig & Meyer Speaker stand package 21449 (black)","0","R 4,180.00"
"KON-21450-000-30","21450-000-30","Konig & Meyer Speaker stand 21450 (anodized aluminium)","2","R 2,026.00"
"KON-21450-000-55","21450-000-55","Konig & Meyer Speaker stand 21450 (anodized black)","0","R 1,798.00"
"KON-22140-300-55","22140-300-55","Konig & Meyer Table flange 221 d (black)","3","R 192.00"
"KON-23200-300-55","23200-300-55","Konig & Meyer 232 Table microphone stand (black)","7","R 689.00"
"KON-23550-300-55","23550-300-55","Konig & Meyer Microphone bar 23550 (black)","0","R 303.00"
"KON-23855-000-55","23855-000-55","Konig & Meyer Table flange 23855 (black)","1","R 437.00"
"KON-24281-000-55","24281-000-55","Konig & Meyer Screw-on adapter 24281 (black)","9","R 750.00"
"KON-24740-000-55","24740-000-55","Konig & Meyer Wind-up stand 4000 24740 (black)","1","R 12,905.00"
"KON-25400-300-55","25400-300-55","Konig & Meyer Microphone stand 25400 (black)","104","R 699.00"
"KON-25900-300-55","25900-300-55","Konig & Meyer Microphone stand 259 (black)","12","R 1,674.00"
"KON-25910-300-55","25910-300-55","Konig & Meyer Microphone stand 259/1 (black)","17","R 1,371.00"
"KON-25950-300-55","25950-300-55","Konig & Meyer Microphone stand >Rien< 25950 (black)","14","R 1,492.00"
